{
  "$schema": "https://json-schema.org/draft/2020-12/schema",
  "$id": "https://pds-template/.ai/agents/tools/_schema.json",
  "title": "Governed Tool Definition",
  "description": "Schema every .ai/agents/tools/*.json and .ai/mcp/tools/*.json must satisfy. Enforced by validator + CI. Version this file in lock-step with agent-config.yaml.",
  "type": "object",
  "required": ["tool_name", "description", "checklist", "safety_level", "requires_approval"],
  "additionalProperties": false,
  "properties": {
    "schema_version": {
      "type": "string",
      "pattern": "^[0-9]+\\.[0-9]+$",
      "description": "Schema version this tool conforms to. Defaults to '1.0' if absent."
    },
    "tool_name": {
      "type": "string",
      "pattern": "^[a-z][a-z0-9-]*[a-z0-9]$",
      "description": "kebab-case identifier; must match the file basename"
    },
    "description": {
      "type": "string",
      "minLength": 20
    },
    "checklist": {
      "type": "array",
      "minItems": 1,
      "items": { "type": "string", "minLength": 5 }
    },
    "safety_level": {
      "type": "string",
      "enum": ["low", "medium", "high", "variable"],
      "description": "'variable' is reserved for meta-tools (e.g., apply-safe-change) that classify safety per call; such tools must set requires_approval=true."
    },
    "requires_approval": {
      "type": "boolean"
    },
    "side_effects": {
      "type": "array",
      "items": {
        "type": "string",
        "enum": ["filesystem-write", "filesystem-delete", "host-mutation", "network", "secret-access", "shell-execute", "none"]
      }
    },
    "inputs": {
      "type": "object",
      "description": "Optional JSON-Schema-style input shape for the tool"
    },
    "outputs": {
      "type": "object",
      "description": "Optional JSON-Schema-style output shape for the tool"
    },
    "context": {
      "description": "Free-form context block (string or object) used by generator-style tools."
    },
    "configuration": {
      "description": "Free-form configuration block (array of strings or object) used by generator-style tools."
    },
    "tools_referenced": {
      "type": "array",
      "items": { "type": "string" },
      "description": "Names of other governed tools this tool composes with."
    },
    "constraints": {
      "description": "Free-form constraints block (array of strings or object)."
    }
  },
  "allOf": [
    {
      "description": "medium / high / variable safety levels must require approval",
      "if": { "properties": { "safety_level": { "enum": ["medium", "high", "variable"] } } },
      "then": { "properties": { "requires_approval": { "const": true } } }
    }
  ]
}
