{
  "tool_name": "anticipate-gaps",
  "description": "Proactively identifies missing pieces, inconsistencies, and future maintenance problems before changes are made.",
  "checklist": [
    "1. Load scoped instructions for current context",
    "2. Analyze proposed changes against architecture patterns",
    "3. Identify missing components (error handling, logging, monitoring, tests)",
    "4. Check for consistency violations",
    "5. Cross-reference with .ai/knowledge/anticipated-gaps.md",
    "6. Generate prioritized gap report",
    "7. Suggest preventive actions"
  ],
  "safety_level": "low",
  "requires_approval": false
}
