{
  "schema_version": "1.0",
  "tool_name": "record-metric",
  "description": "Append-only metrics writer. Every agent calls this at the end of its invocation (and at heartbeat) to emit one structured event capturing tokens, context-budget consumption, tool-call counts, latency, approval gates hit, and outcome. Output feeds the observer agent and /ai-metrics. Generic — never embeds vendor-specific fields.",
  "checklist": [
    "1. Validate envelope has trace_id; refuse if absent (every metric must be correlatable)",
    "2. Determine today's metrics file: .ai/logs/metrics-YYYY-MM-DD.jsonl",
    "3. Build the event per the inputs schema below; never include secrets, user content, or full file bodies",
    "4. Token counts: pass-through from the host runtime if available; null is acceptable but discouraged",
    "5. Append exactly one JSON line (jsonl, one event per line); never rewrite prior lines",
    "6. Mirror a one-line human-readable entry into the daily session log via log-action with action='metric-recorded', files_affected=[metrics file]",
    "7. On disk-full or write failure, surface the error to the caller; never swallow"
  ],
  "safety_level": "low",
  "requires_approval": false,
  "side_effects": ["filesystem-write"],
  "inputs": {
    "type": "object",
    "required": ["trace_id", "agent", "stage", "outcome"],
    "properties": {
      "schema_version": { "type": "string", "default": "1.0" },
      "trace_id": { "type": "string" },
      "agent": { "type": "string", "description": "Agent name from .github/agents/<name>.agent.md" },
      "stage": { "type": "string", "description": "Pipeline stage or 'standalone'" },
      "started_at": { "type": "string", "description": "ISO 8601" },
      "ended_at": { "type": "string", "description": "ISO 8601" },
      "duration_ms": { "type": "integer", "minimum": 0 },
      "tokens": {
        "type": "object",
        "properties": {
          "prompt": { "type": ["integer", "null"] },
          "completion": { "type": ["integer", "null"] },
          "total": { "type": ["integer", "null"] }
        }
      },
      "context": {
        "type": "object",
        "description": "Context-budget consumption per agents/context.md#context-budgets",
        "properties": {
          "files_read": { "type": "integer", "minimum": 0 },
          "bytes_read": { "type": "integer", "minimum": 0 },
          "files_budget": { "type": "integer", "minimum": 0 },
          "bytes_budget": { "type": "integer", "minimum": 0 },
          "exceeded": { "type": "boolean" }
        }
      },
      "tool_calls": {
        "type": "object",
        "description": "Counts by governed-tool name",
        "additionalProperties": { "type": "integer", "minimum": 0 }
      },
      "approvals": {
        "type": "object",
        "properties": {
          "requested": { "type": "integer", "minimum": 0 },
          "granted": { "type": "integer", "minimum": 0 },
          "denied": { "type": "integer", "minimum": 0 }
        }
      },
      "outcome": { "enum": ["success", "block", "warn", "skipped", "failed", "paused"] },
      "verdict_handoff": { "type": ["string", "null"], "description": "Next agent if this was a routing/handoff event" },
      "notes": { "type": "string", "description": "One-line free-form; never include secrets" }
    },
    "additionalProperties": false
  }
}
